"title","level","service","category","description","id"
"Suspicious Kernel Dump Using Dtrace","high","","process_creation","Detects suspicious way to dump the kernel on Windows systems using dtrace.exe, which is available on Windows systems since Windows 10 19H1","6b74eb79-fb17-b0d5-5a82-d54803b88ead"
"Certificate Exported Via PowerShell","medium","","process_creation","Detects calls to cmdlets that are used to export certificates from the local certificate store. Threat actors were seen abusing this to steal private keys from compromised machines.","909ad08b-a33e-57b8-8a0e-98a42a566b03"
"Suspicious Key Manager Access","high","","process_creation","Detects the invocation of the Stored User Names and Passwords dialogue (Key Manager)","01184351-0c59-01e2-23f8-68eb74e51558"
"Powershell Executed From Headless ConHost Process","medium","","process_creation","Detects the use of powershell commands from headless ConHost window.
The ""--headless"" flag hides the windows from the user upon execution.
","0df72588-414b-1bc3-7b9d-ea4a01af56db"
"HH.EXE Execution","low","","process_creation","Detects the execution of ""hh.exe"" to open "".chm"" files.","cb0503aa-0857-ee4c-cde4-211dcf7917f8"
"Windows Firewall Disabled via PowerShell","medium","","process_creation","Detects attempts to disable the Windows Firewall using PowerShell","bb0b061c-443d-7026-485e-32bd309fb7d9"
"HackTool - SharPersist Execution","high","","process_creation","Detects the execution of the hacktool SharPersist - used to deploy various different kinds of persistence mechanisms","d60bae71-ab70-95e8-ce1c-c0226f62a597"
"MSExchange Transport Agent Installation","medium","","process_creation","Detects the Installation of a Exchange Transport Agent","5bc86f64-e263-f14b-6525-bacad0b088ad"
"PUA - Adidnsdump Execution","low","","process_creation","This tool enables enumeration and exporting of all DNS records in the zone for recon purposes of internal networks Python 3 and python.exe must be installed,
Usee to Query/modify DNS records for Active Directory integrated DNS via LDAP
","e88b49c4-9d10-2b2d-da20-8934c2de27db"
"Cloudflared Tunnel Execution","medium","","process_creation","Detects execution of the ""cloudflared"" tool to connect back to a tunnel. This was seen used by threat actors to maintain persistence and remote access to compromised networks.","0fea9c26-5302-3b51-7884-b9ed47e74157"
"Renamed AutoIt Execution","high","","process_creation","Detects the execution of a renamed AutoIt2.exe or AutoIt3.exe.
AutoIt is a scripting language and automation tool for Windows systems. While primarily used for legitimate automation tasks, it can be misused in cyber attacks.
Attackers can leverage AutoIt to create and distribute malware, including keyloggers, spyware, and botnets. A renamed AutoIt executable is particularly suspicious.
","6c6e8f1c-70aa-c21c-7860-3cd72022adb7"
"Files Added To An Archive Using Rar.EXE","low","","process_creation","Detects usage of ""rar"" to add files to an archive for potential compression. An adversary may compress data (e.g. sensitive documents) that is collected prior to exfiltration in order to make it portable and minimize the amount of data sent over the network.","4033fb39-b0df-89aa-584b-12d73c5e5bd6"
"Indirect Command Execution By Program Compatibility Wizard","low","","process_creation","Detect indirect command execution via Program Compatibility Assistant pcwrun.exe","f4b28578-b356-1cbb-4554-acd9a8b62c9b"
"HackTool - RedMimicry Winnti Playbook Execution","high","","process_creation","Detects actions caused by the RedMimicry Winnti playbook a automated breach emulations utility","a649199e-56ae-51bf-53e5-69e87b06e563"
"UAC Bypass Using Consent and Comctl32 - Process","high","","process_creation","Detects the pattern of UAC Bypass using consent.exe and comctl32.dll (UACMe 22)","fae361cc-c4b0-0935-1b15-79113e3f6198"
"Msiexec Quiet Installation","medium","","process_creation","Adversaries may abuse msiexec.exe to proxy execution of malicious payloads.
Msiexec.exe is the command-line utility for the Windows Installer and is thus commonly associated with executing installation packages (.msi)
","56fda9b4-d3c0-2709-26ea-b109bdafb5c2"
"HackTool - HandleKatz LSASS Dumper Execution","high","","process_creation","Detects the use of HandleKatz, a tool that demonstrates the usage of cloned handles to Lsass in order to create an obfuscated memory dump of the same","e9ec99cd-f425-c533-3e51-bf39335dbe29"
"Obfuscated IP Via CLI","medium","","process_creation","Detects usage of an encoded/obfuscated version of an IP address (hex, octal, etc.) via command line","85c1b693-1ea8-0d6c-249a-3a2bffdd4bb4"
"Suspicious Child Process Of Wermgr.EXE","high","","process_creation","Detects suspicious Windows Error Reporting manager (wermgr.exe) child process","65769ded-2258-284c-b61d-e79567f5efc0"
"Arbitrary Binary Execution Using GUP Utility","medium","","process_creation","Detects execution of the Notepad++ updater (gup) to launch other commands or executables","3d30b2bb-135f-d972-364f-9e41f8aa609b"
"ConvertTo-SecureString Cmdlet Usage Via CommandLine","medium","","process_creation","Detects usage of the ""ConvertTo-SecureString"" cmdlet via the commandline. Which is fairly uncommon and could indicate potential suspicious activity","ebcee1df-9cac-a989-982c-08e181e9d5a8"
"PUA - SoftPerfect Netscan Execution","medium","","process_creation","Detects usage of SoftPerfect's ""netscan.exe"". An application for scanning networks.
It is actively used in-the-wild by threat actors to inspect and understand the network architecture of a victim.
","d14c21ed-9fb4-dd37-d9a0-df7cd5f8092b"
"Suspicious Reconnaissance Activity Via GatherNetworkInfo.VBS","high","","process_creation","Detects execution of the built-in script located in ""C:\Windows\System32\gatherNetworkInfo.vbs"". Which can be used to gather information about the target machine","51e070ce-c40e-99ba-6652-7a5ac4f85fea"
"PUA - WebBrowserPassView Execution","medium","","process_creation","Detects the execution of WebBrowserPassView.exe. A password recovery tool that reveals the passwords stored by the following Web browsers, Internet Explorer (Version 4.0 - 11.0), Mozilla Firefox (All Versions), Google Chrome, Safari, and Opera","fbf11b3a-b52f-1a2a-a481-d059609954fa"
"Suspicious Schtasks Schedule Types","high","","process_creation","Detects scheduled task creations or modification on a suspicious schedule type","03483409-2c67-3117-debd-eaa756713643"
"HackTool - PCHunter Execution","high","","process_creation","Detects suspicious use of PCHunter, a tool like Process Hacker to view and manipulate processes, kernel options and other low level stuff","a40c99d5-1323-f65d-73d1-ca673940b7b2"
"Suspicious Mstsc.EXE Execution With Local RDP File","high","","process_creation","Detects potential RDP connection via Mstsc using a local "".rdp"" file located in suspicious locations.","b881e130-b2f3-59a2-f31f-1ab4f003c199"
"Suspicious Windows Trace ETW Session Tamper Via Logman.EXE","high","","process_creation","Detects the execution of ""logman"" utility in order to disable or delete Windows trace sessions","b4f46720-2a2a-38d0-a77b-cd70dfbd3151"
"Uncommon Svchost Parent Process","medium","","process_creation","Detects an uncommon svchost parent process","057c8ea6-1759-bf0b-4271-d71dfc700239"
"Renamed CreateDump Utility Execution","high","","process_creation","Detects uses of a renamed legitimate createdump.exe LOLOBIN utility to dump process memory","b206cc55-bd72-1034-393c-cb8b9e643aa0"
"Visual Studio NodejsTools PressAnyKey Arbitrary Binary Execution","medium","","process_creation","Detects child processes of Microsoft.NodejsTools.PressAnyKey.exe that can be used to execute any other binary","a5a31ba8-6ecb-ba33-f271-5a50afc76d9b"
"Suspicious Obfuscated PowerShell Code","high","","process_creation","Detects suspicious UTF16 and base64 encoded and often obfuscated PowerShell code often used in command lines","90b43135-d789-00ee-977c-ed235554c372"
"Ping Hex IP","high","","process_creation","Detects a ping command that uses a hex encoded IP address","8f1f0cfc-418f-58d0-6c0a-aa9299b3d5e5"
"Csc.EXE Execution Form Potentially Suspicious Parent","high","","process_creation","Detects a potentially suspicious parent of ""csc.exe"", which could be a sign of payload delivery.","46903700-a139-8e57-f71a-3b0e0c0b1fb5"
"Possible Privilege Escalation via Weak Service Permissions","high","","process_creation","Detection of sc.exe utility spawning by user with Medium integrity level to change service ImagePath or FailureCommand","ae65ef8c-318b-89f9-30d3-1f3bcfab81e9"
"RDP Connection Allowed Via Netsh.EXE","high","","process_creation","Detects usage of the netsh command to open and allow connections to port 3389 (RDP). As seen used by Sarwent Malware","06d89cd2-498f-efd1-2df7-79500d0e99e0"
"PUA - AdFind.EXE Execution","medium","","process_creation","Detects execution of Adfind.exe utility, which can be used for reconnaissance in an Active Directory environment","5cba86ae-86b3-1aba-fe62-8b82c1fb1f92"
"PUA - DIT Snapshot Viewer","high","","process_creation","Detects the use of Ditsnap tool, an inspection tool for Active Directory database, ntds.dit.","835ff144-018a-4ec5-3788-ea773f0fd869"
"Powershell Inline Execution From A File","medium","","process_creation","Detects inline execution of PowerShell code from a file","58d3ef60-05d8-9a87-7fde-3bd696dba247"
"Potential Suspicious Mofcomp Execution","high","","process_creation","Detects execution of the ""mofcomp"" utility as a child of a suspicious shell or script running utility or by having a suspicious path in the commandline.
The ""mofcomp"" utility parses a file containing MOF statements and adds the classes and class instances defined in the file to the WMI repository.
Attackers abuse this utility to install malicious MOF scripts
","7ff57038-20dd-b144-f4f9-fe2fb075e004"
"Potential LethalHTA Technique Execution","high","","process_creation","Detects potential LethalHTA technique where the ""mshta.exe"" is spawned by an ""svchost.exe"" process","f9884b6b-0ac3-139d-1ebe-a5587c9a51fd"
"Potential Powershell ReverseShell Connection","high","","process_creation","Detects usage of the ""TcpClient"" class. Which can be abused to establish remote connections and reverse-shells. As seen used by the Nishang ""Invoke-PowerShellTcpOneLine"" reverse shell and other.","0e017e81-3278-cb76-d706-690f05a18a0e"
"File Encryption/Decryption Via Gpg4win From Suspicious Locations","high","","process_creation","Detects usage of Gpg4win to encrypt/decrypt files located in potentially suspicious locations.","6e3409a5-e74b-e405-2f94-d7be95561e7e"
"Pubprn.vbs Proxy Execution","medium","","process_creation","Detects the use of the 'Pubprn.vbs' Microsoft signed script to execute commands.","b176b53d-4619-d65f-baf1-b3a4f1ec0b12"
"Potential Arbitrary Command Execution Via FTP.EXE","medium","","process_creation","Detects execution of ""ftp.exe"" script with the ""-s"" or ""/s"" flag and any child processes ran by ""ftp.exe"".","26132f4c-3dfc-593f-2d62-2e8ff59e0720"
"Invoke-Obfuscation STDIN+ Launcher","high","","process_creation","Detects Obfuscated use of stdin to execute PowerShell","0b1a8cb5-34ab-b019-66ad-98f7c43bb8ff"
"PktMon.EXE Execution","medium","","process_creation","Detects execution of PktMon, a tool that captures network packets.","94ae2cf8-1a32-d069-3ee0-eaae5f14745e"
"Suspicious Response File Execution Via Odbcconf.EXE","high","","process_creation","Detects execution of ""odbcconf"" with the ""-f"" flag in order to load a response file with a non-"".rsp"" extension.","bf24bd95-9545-2701-9d44-5f8a6769a3bb"
"Always Install Elevated MSI Spawned Cmd And Powershell","medium","","process_creation","Detects Windows Installer service (msiexec.exe) spawning ""cmd"" or ""powershell""","3679f255-d90a-49da-389c-bb16db65853c"
"Import PowerShell Modules From Suspicious Directories - ProcCreation","medium","","process_creation","Detects powershell scripts that import modules from suspicious directories","d671a75d-7b95-f624-cf04-8c7814fca3aa"
"Suspicious Program Names","high","","process_creation","Detects suspicious patterns in program names or folders that are often found in malicious samples or hacktools","9c2f40db-46e4-85f0-3104-427e61b344a1"
"Script Interpreter Execution From Suspicious Folder","high","","process_creation","Detects a suspicious script execution in temporary folders or folders accessible by environment variables","962dcd71-b0d7-ad49-1fe6-2966daf7a411"
"Changing Existing Service ImagePath Value Via Reg.EXE","medium","","process_creation","Adversaries may execute their own malicious payloads by hijacking the Registry entries used by services.
Adversaries may use flaws in the permissions for registry to redirect from the originally specified executable to one that they control, in order to launch their own code at Service start.
Windows stores local service configuration information in the Registry under HKLM\SYSTEM\CurrentControlSet\Services
","3c74726b-21b2-7edc-9091-a8cb4cd92eb0"
"Suspicious Outlook Child Process","high","","process_creation","Detects a suspicious process spawning from an Outlook process.","ce29d50b-8a96-dc9b-96a1-3acbb2b68039"
"WmiPrvSE Spawned A Process","medium","","process_creation","Detects WmiPrvSE spawning a process","26773337-b821-6c5b-2c1f-2e6cca581b84"
"New DNS ServerLevelPluginDll Installed Via Dnscmd.EXE","high","","process_creation","Detects the installation of a DNS plugin DLL via ServerLevelPluginDll parameter in registry, which can be used to execute code in context of the DNS server (restart required)","125653c0-b2ab-c23a-d7aa-6a45f2add313"
"Exchange PowerShell Snap-Ins Usage","high","","process_creation","Detects adding and using Exchange PowerShell snap-ins to export mailbox data. As seen used by HAFNIUM and APT27","e51338a7-866e-5cc3-f8f9-7b12fc3aa56b"
"Port Forwarding Activity Via SSH.EXE","medium","","process_creation","Detects port forwarding activity via SSH.exe","9f52bf0b-cd07-33a3-f9c1-6cf08889812a"
"HackTool - Inveigh Execution","critical","","process_creation","Detects the use of Inveigh a cross-platform .NET IPv4/IPv6 machine-in-the-middle tool","f5338a44-bd1b-81a7-3b76-7e2efbe1ce0d"
"Suspicious Invoke-WebRequest Execution","high","","process_creation","Detects a suspicious call to Invoke-WebRequest cmdlet where the and output is located in a suspicious location","65dc2fc6-8f96-eccf-0cba-714a1f3af110"
"Fsutil Behavior Set SymlinkEvaluation","medium","","process_creation","A symbolic link is a type of file that contains a reference to another file.
This is probably done to make sure that the ransomware is able to follow shortcuts on the machine in order to find the original file to encrypt
","7e75fbd5-4501-e7c8-deb1-b24ea8448793"
"Suspicious FromBase64String Usage On Gzip Archive - Process Creation","medium","","process_creation","Detects attempts of decoding a base64 Gzip archive via PowerShell. This technique is often used as a method to load malicious content into memory afterward.","d4107fed-b19a-c873-993e-db24e6528e9f"
"Suspicious Download From File-Sharing Website Via Bitsadmin","high","","process_creation","Detects usage of bitsadmin downloading a file from a suspicious domain","23c16dc8-5f28-940b-9094-092e89b8727f"
"PowerShell Get-Process LSASS","high","","process_creation","Detects a ""Get-Process"" cmdlet and it's aliases on lsass process, which is in almost all cases a sign of malicious activity","0ac2cb1c-3284-c46e-dd61-1fd81302ad3c"
"Stop Windows Service Via Sc.EXE","low","","process_creation","Detects the stopping of a Windows service via the ""sc.exe"" utility","115267f9-0227-94b2-f6ef-56939bd2c693"
"Suspicious Processes Spawned by WinRM","high","","process_creation","Detects suspicious processes including shells spawnd from WinRM host process","7d84c2d9-4528-bdae-4cc2-945948102cbd"
"SyncAppvPublishingServer VBS Execute Arbitrary PowerShell Code","medium","","process_creation","Executes arbitrary PowerShell code using SyncAppvPublishingServer.vbs","3acb1e73-2bdc-efdf-3865-3967cf6ce445"
"Potentially Suspicious Child Process Of ClickOnce Application","medium","","process_creation","Detects potentially suspicious child processes of a ClickOnce deployment application","66a0246c-c8ba-1f83-d729-7de76ec64ee7"
"Suspect Svchost Activity","high","","process_creation","It is extremely abnormal for svchost.exe to spawn without any CLI arguments and is normally observed when a malicious process spawns the process and injects code into the process memory space.","bb0ae7bd-c963-0404-061e-ae3c6b866830"
"PsExec Service Execution","medium","","process_creation","Detects launch of the PSEXESVC service, which means that this system was the target of a psexec remote execution","063b6d5e-3f4e-c3a0-f506-0f8296b9eec4"
"Audit Policy Tampering Via NT Resource Kit Auditpol","high","","process_creation","Threat actors can use an older version of the auditpol binary available inside the NT resource kit to change audit policy configuration to impair detection capability.
This can be carried out by selectively disabling/removing certain audit policies as well as restoring a custom policy owned by the threat actor.
","614f34c3-e108-8880-5b20-f3df7e3ccd9e"
"Proxy Execution Via Wuauclt.EXE","high","","process_creation","Detects the use of the Windows Update Client binary (wuauclt.exe) for proxy execution.","7badcd39-a428-768b-6bd0-e5db3b7fa90e"
"PUA - AdFind Suspicious Execution","high","","process_creation","Detects AdFind execution with common flags seen used during attacks","241ae810-4742-fb7e-24a5-9fe5b120827a"
"File Decryption Using Gpg4win","medium","","process_creation","Detects usage of Gpg4win to decrypt files","f539aaee-c369-f209-b744-3e1b8b37c936"
"Remote Access Tool - Anydesk Execution From Suspicious Folder","high","","process_creation","An adversary may use legitimate desktop support and remote access software, such as Team Viewer, Go2Assist, LogMein, AmmyyAdmin, etc, to establish an interactive command and control channel to target systems within networks.
These services are commonly used as legitimate technical support software, and may be allowed by application control within a target environment.
Remote access tools like VNC, Ammyy, and Teamviewer are used frequently when compared with other legitimate software commonly used by adversaries. (Citation: Symantec Living off the Land)
","9974aa8a-7f9d-e45d-d1f2-353a893b2572"
"Recon Command Output Piped To Findstr.EXE","medium","","process_creation","Detects the execution of a potential recon command where the results are piped to ""findstr"". This is meant to trigger on inline calls of ""cmd.exe"" via the ""/c"" or ""/k"" for example.
Attackers often time use this technique to extract specific information they require in their reconnaissance phase.
","afc0e7da-4e96-1953-3fa3-8e9112c06c1c"
"Remote Access Tool - ScreenConnect Server Web Shell Execution","high","","process_creation","Detects potential web shell execution from the ScreenConnect server process.","e8e1c7ac-50e7-03e1-c3d6-e1192efc4260"
"Control Panel Items","high","","process_creation","Detects the malicious use of a control panel item","412f66af-4b64-0d69-8b91-9fa5161724cd"
"Verclsid.exe Runs COM Object","medium","","process_creation","Detects when verclsid.exe is used to run COM object via GUID","f95fb96e-dacc-23fa-9a80-f509e7973c9f"
"New User Created Via Net.EXE","medium","","process_creation","Identifies the creation of local users via the net.exe command.","6770bbc3-76b1-d22f-6192-d180542dc2a2"
"Execution Of Non-Existing File","high","","process_creation","Checks whether the image specified in a process creation event is not a full, absolute path (caused by process ghosting or other unorthodox methods to start a process)","5385a182-a453-d329-5d89-d768e2b73e28"
"Potential Renamed Rundll32 Execution","high","","process_creation","Detects when 'DllRegisterServer' is called in the commandline and the image is not rundll32. This could mean that the 'rundll32' utility has been renamed in order to avoid detection","04f5d1ee-1b2f-dc73-a3fd-a7277cb56195"
"HackTool - Bloodhound/Sharphound Execution","high","","process_creation","Detects command line parameters used by Bloodhound and Sharphound hack tools","37366c60-8aea-e3e5-bae7-3c24e54f629b"
"PUA - AdvancedRun Suspicious Execution","high","","process_creation","Detects the execution of AdvancedRun utility in the context of the TrustedInstaller, SYSTEM, Local Service or Network Service accounts","a407b6c9-ae1a-6fb2-a44d-24de12a2e2f7"
"Arbitrary File Download Via PresentationHost.EXE","medium","","process_creation","Detects usage of ""PresentationHost"" which is a utility that runs "".xbap"" (Browser Applications) files to download arbitrary files","1a42614f-8e9e-d03e-5c6e-b4003ed85cf7"
"AddinUtil.EXE Execution From Uncommon Directory","medium","","process_creation","Detects execution of the Add-In deployment cache updating utility (AddInutil.exe) from a non-standard directory.","b229510a-6249-effe-47a7-1453bddf03a7"
"Suspicious File Download From File Sharing Domain Via Curl.EXE","high","","process_creation","Detects potentially suspicious file download from file sharing domains using curl.exe","ebccbc0b-0513-7912-7679-1ff5d676842e"
"HackTool - Certify Execution","high","","process_creation","Detects Certify a tool for Active Directory certificate abuse based on PE metadata characteristics and common command line arguments.","ff27f8e8-0d0c-7ee1-fc19-a2d8cd69186a"
"PowerShell Base64 Encoded Invoke Keyword","high","","process_creation","Detects UTF-8 and UTF-16 Base64 encoded powershell 'Invoke-' calls","0d0facfd-ddef-e44b-f118-c42aff14db7a"
"Suspicious JavaScript Execution Via Mshta.EXE","high","","process_creation","Detects execution of javascript code using ""mshta.exe"".","40dc8b10-369e-d60a-531b-a6d6de0bad18"
"Suspicious Child Process Of SQL Server","high","","process_creation","Detects suspicious child processes of the SQLServer process. This could indicate potential RCE or SQL Injection.","e5fef5f3-db95-fac1-d6a8-ebe5cea61016"
"Suspicious WmiPrvSE Child Process","high","","process_creation","Detects suspicious and uncommon child processes of WmiPrvSE","19090407-d63d-5d05-f03e-f254980d972c"
"Persistence Via Sticky Key Backdoor","critical","","process_creation","By replacing the sticky keys executable with the local admins CMD executable, an attacker is able to access a privileged windows console session without authenticating to the system.
When the sticky keys are ""activated"" the privilleged shell is launched.
","61dd8b58-6c93-639f-6342-1ba077ce0f45"
"Suspicious Double Extension File Execution","high","","process_creation","Detects suspicious use of an .exe extension after a non-executable file extension like .pdf.exe, a set of spaces or underlines to cloak the executable file in spear phishing campaigns","452b2159-5e6e-c494-63b9-b385d6195f58"
"Uncommon Userinit Child Process","high","","process_creation","Detects uncommon ""userinit.exe"" child processes, which could be a sign of uncommon shells or login scripts used for persistence.","8d2051ab-4ac8-617f-7be7-3a2c8e1a8aa8"
"HackTool - Hydra Password Bruteforce Execution","high","","process_creation","Detects command line parameters used by Hydra password guessing hack tool","77f6e2f1-7fec-6f30-aa0e-cec73ad32fc1"
"Program Executed Using Proxy/Local Command Via SSH.EXE","medium","","process_creation","Detect usage of the ""ssh.exe"" binary as a proxy to launch other programs.","c9a20835-ce7c-8118-9269-64b5a5e8cbb5"
"HackTool - KrbRelayUp Execution","high","","process_creation","Detects KrbRelayUp used to perform a universal no-fix local privilege escalation in Windows domain environments where LDAP signing is not enforced","6408b665-07d6-1525-496f-24511bfff69c"
"Potential Windows Defender Tampering Via Wmic.EXE","high","","process_creation","Detects potential tampering with Windows Defender settings such as adding exclusion using wmic","21d20eb3-388b-e372-90f5-c3da2c00dc9f"
"Replace.exe Usage","medium","","process_creation","Detects the use of Replace.exe which can be used to replace file with another file","02224309-c907-6de7-60e0-09470aa6d721"
"Potential PowerShell Execution Via DLL","high","","process_creation","Detects potential PowerShell execution from a DLL instead of the usual PowerShell process as seen used in PowerShdll.
This detection assumes that PowerShell commands are passed via the CommandLine.
","52aeb4d7-4368-4da4-c717-f3b016a01d64"
"Devtoolslauncher.exe Executes Specified Binary","high","","process_creation","The Devtoolslauncher.exe executes other binary","415d9b8e-8ea7-ce1d-44e5-f124d411e636"
"Potentially Suspicious Office Document Executed From Trusted Location","high","","process_creation","Detects the execution of an Office application that points to a document that is located in a trusted location. Attackers often used this to avoid macro security and execute their malicious code.","773a2339-22b1-7f0c-c821-a5831b6a43cc"
"Rundll32 Registered COM Objects","high","","process_creation","load malicious registered COM objects","a405c36d-82ac-5145-4a6a-8451f4ed7205"
"Cmd.EXE Missing Space Characters Execution Anomaly","high","","process_creation","Detects Windows command lines that miss a space before or after the /c flag when running a command using the cmd.exe.
This could be a sign of obfuscation of a fat finger problem (typo by the developer).
","8a1ff7a8-dc08-8d51-6f44-ebf8369d583a"
"Password Provided In Command Line Of Net.EXE","medium","","process_creation","Detects a when net.exe is called with a password in the command line","63b59ec7-e487-aef1-5cca-722ee215db7f"
"Execution of Powershell Script in Public Folder","high","","process_creation","This rule detects execution of PowerShell scripts located in the ""C:\Users\Public"" folder","cc44ef1f-3f00-4bc6-c537-2858c567e845"
