"title","level","service","category","description","id"
"Network Connection Initiated From Users\Public Folder","medium","","network_connection","Detects a network connection initiated from a process located in the ""C:\Users\Public"" folder.
Attacker are known to drop their malicious payloads and malware in this directory as its writable by everyone.
Use this rule to hunt for potential suspicious or uncommon activity in your environement.
","a1027f51-4eb5-a16d-91bf-9e124bb594dd"
"Network Connection Initiated By PowerShell Process","low","","network_connection","Detects a network connection that was initiated from a PowerShell process.
Often times malicious powershell scripts download additional payloads or communicate back to command and control channels via uncommon ports or IPs.
Use this rule as a basis for hunting for anomalies.
","9e00ae65-e5aa-2c89-c7a1-7b6ee0e194f5"
"Dfsvc.EXE Network Connection To Non-Local IPs","medium","","network_connection","Detects network connections from ""dfsvc.exe"" used to handled ClickOnce applications to non-local IPs","713fd43d-88e4-6801-2eac-756d06792d4f"
"HH.EXE Initiated HTTP Network Connection","medium","","network_connection","Detects a network connection initiated by the ""hh.exe"" process to HTTP destination ports, which could indicate the execution/download of remotely hosted .chm files.
","13790f2d-97b2-d1a0-6624-1061d7ccbb8c"
"Dfsvc.EXE Initiated Network Connection Over Uncommon Port","high","","network_connection","Detects an initiated network connection over uncommon ports from ""dfsvc.exe"". A utility used to handled ClickOnce applications.","4255ccee-f954-7d80-4281-d5a5fe9ea9f7"
"Dllhost.EXE Initiated Network Connection To Non-Local IP Address","medium","","network_connection","Detects Dllhost.EXE initiating a network connection to a non-local IP address.
Aside from Microsoft own IP range that needs to be excluded. Network communication from Dllhost will depend entirely on the hosted DLL.
An initial baseline is recommended before deployment.
","1062d249-f014-9faf-044e-2b75d6f9763f"
"Msiexec.EXE Initiated Network Connection Over HTTP","low","","network_connection","Detects a network connection initiated by an ""Msiexec.exe"" process over port 80 or 443.
Adversaries might abuse ""msiexec.exe"" to install and execute remotely hosted packages.
Use this rule to hunt for potentially anomalous or suspicious communications.
","8696ae22-70c1-ca19-4888-66ed19ea27da"
"Scheduled Task Deletion","low","security","","Detects scheduled task deletion events. Scheduled tasks are likely to be deleted if not used for persistence. Malicious Software often creates tasks directly under the root node e.g. \TASKNAME","68d6fb03-e325-2ed1-a429-abac7adf7ba3"
"New RDP Connection Initiated From Domain Controller","high","","network_connection","Detects an RDP connection originating from a domain controller.","8b0f1458-5a23-5950-ebc7-f8d7a562dc06"
"Diamond Sleet APT Scheduled Task Creation","critical","security","","Detects registry event related to the creation of a scheduled task used by Diamond Sleet APT during exploitation of Team City CVE-2023-42793 vulnerability
","05731ce3-cfda-dbba-3792-c17794a22cf7"
"Scheduled Tasks Names Used By SVR For GraphicalProton Backdoor","high","security","","Hunts for known SVR-specific scheduled task names","ae16af08-e56e-414a-ceba-cb62e9f3a2ef"
"OilRig APT Schedule Task Persistence - Security","critical","security","","Detects OilRig schedule task persistence as reported by Nyotron in their March 2018 report","798c8f65-068a-0a31-009f-12739f547a2d"
"Defrag Deactivation - Security","medium","security","","Detects the deactivation and disabling of the Scheduled defragmentation task as seen by Slingshot APT group","e4c7a334-7ecb-ef93-85dd-49185891fb7a"
"Kapeka Backdoor Scheduled Task Creation","high","security","","Detects Kapeka backdoor scheduled task creation based on attributes such as paths, commands line flags, etc.","fa0084fc-2105-cdc9-c7c1-1752bbb2e4d2"
"Net Conn","informational","security","","The Windows Filtering Platform has allowed a connection.","d0a61a11-57c9-4afc-b940-3f19b60db08e"
"Net Conn Blocked","informational","security","","The Windows Filtering Platform has blocked a connection.","b793a8e6-28a4-4fb8-816e-17a99e4e7b40"
"Task Deleted","informational","security","","Scheduled task was deleted.","de5ed02e-e7b5-47a0-a35c-06a907c988e4"
"Task Created","informational","security","","Scheduled task created. Malware often persists with tasks but also used legitimately often as well.","60d768ca-33e8-4f34-b967-14fd7aa18a22"
"Suspicious Multiple File Rename Or Delete Occurred","medium","security","","Detects multiple file rename or delete events occurrence within a specified period of time by a same user (these events may signalize about ransomware activity).","a4504cb2-23f6-6d94-5ae6-d6013cf1d995"
"Stored Credentials in Fake Files","high","security","","Search for accessing of fake files with stored credentials","888d3e17-a1ed-6b11-895c-e1f9b96b35be"
"Sysmon Channel Reference Deletion","high","security","","Potential threat actor tampering with Sysmon manifest and eventually disabling it","249d836c-8857-1b98-5d7b-050c2d34e275"
"SCM Database Handle Failure","medium","security","","Detects non-system users failing to get a handle of the SCM database.","474caaa9-3115-c838-1509-59ffb6caecfc"
"LSASS Access From Non System Account","medium","security","","Detects potential mimikatz-like tools accessing LSASS from non system account","06b8bcc0-326b-518a-3868-fe0721488fb8"
"WCE wceaux.dll Access","critical","security","","Detects wceaux.dll access while WCE pass-the-hash remote command execution on source host","de10da38-ee60-f6a4-7d70-4d308558158b"
"Password Dumper Activity on LSASS","high","security","","Detects process handle on LSASS process with certain access mask and object type SAM_DOMAIN","d81faa44-ff28-8f61-097b-92727b8af44b"
"Processes Accessing the Microphone and Webcam","medium","security","","Potential adversaries accessing the microphone and webcam in an endpoint.","32337bc9-8e75-bdaf-eaf4-d3b19ee08a67"
"SAM Registry Hive Handle Request","high","security","","Detects handles requested to SAM registry hive","d7742b08-730d-3624-df95-cc3c6eaa3a39"
"Potential Secure Deletion with SDelete","medium","security","","Detects files that have extensions commonly seen while SDelete is used to wipe files.","70c3269a-a7f2-49bd-1e28-a0921f353db7"
"SysKey Registry Keys Access","high","security","","Detects handle requests and access operations to specific registry keys to calculate the SysKey","63308dbe-54a4-9c70-cc90-6d15e10f3505"
"Service Registry Key Read Access Request","low","security","","Detects ""read access"" requests on the services registry key.
Adversaries may execute their own malicious payloads by hijacking the Registry entries used by services.
Adversaries may use flaws in the permissions for Registry keys related to services to redirect from the originally specified executable to one that they control, in order to launch their own code when a service starts.
","d1909400-93d7-de3c-ba13-153c64499c7c"
"Azure AD Health Service Agents Registry Keys Access","medium","security","","This detection uses Windows security events to detect suspicious access attempts to the registry key values and sub-keys of Azure AD Health service agents (e.g AD FS).
Information from AD Health service agents can be used to potentially abuse some of the features provided by those services in the cloud (e.g. Federation).
This detection requires an access control entry (ACE) on the system access control list (SACL) of the following securable object: HKLM:\SOFTWARE\Microsoft\ADHealthAgent.
Make sure you set the SACL to propagate to its sub-keys.
","763d50d7-9452-0146-18a1-9ca65e3a2f73"
"ISO Image Mounted","medium","security","","Detects the mount of an ISO image on an endpoint","4faa08cb-e57e-bb07-cfc2-2153a97a99bf"
"Azure AD Health Monitoring Agent Registry Keys Access","medium","security","","This detection uses Windows security events to detect suspicious access attempts to the registry key of Azure AD Health monitoring agent.
This detection requires an access control entry (ACE) on the system access control list (SACL) of the following securable object HKLM\SOFTWARE\Microsoft\Microsoft Online\Reporting\MonitoringAgent.
","321196fe-fb10-6b13-c611-3dfe40baa1af"
"Suspicious Teams Application Related ObjectAcess Event","high","security","","Detects an access to authentication tokens and accounts of Microsoft Teams desktop application.","04a055ea-ffa9-540b-e1d2-d5c1bfd5bc7b"
"Potentially Suspicious AccessMask Requested From LSASS","medium","security","","Detects process handle on LSASS process with certain access mask","c7f94c63-6fb7-9686-e2c2-2298c9f56ca9"
"Windows Defender Exclusion Registry Key - Write Access Requested","medium","security","","Detects write access requests to the Windows Defender exclusions registry keys. This could be an indication of an attacker trying to request a handle or access the object to write new exclusions in order to bypass security.
","777523b0-14f8-1ca2-12c9-d668153661ff"
"Windows Defender Exclusion Deleted","medium","security","","Detects when a Windows Defender exclusion has been deleted. This could indicate an attacker trying to delete their tracks by removing the added exclusions
","7bd85790-c82a-56af-7127-f257e5ef6c6f"
"Access To Browser Credential Files By Uncommon Applications - Security","low","security","","Detects file access requests to browser credential stores by uncommon processes. Could indicate potential attempt of credential stealing This rule requires heavy baselining before usage.
","7619b716-8052-6323-d9c7-87923ef591e6"
"CVE-2023-23397 Exploitation Attempt","critical","security","","Detects outlook initiating connection to a WebDAV or SMB share, which could be a sign of CVE-2023-23397 exploitation.","1aeb71a3-31b4-1a5e-85d8-1631c3a73d43"
"BlueSky Ransomware Artefacts","high","security","","Detect access to files and shares with names and extensions used by BlueSky ransomware which could indicate a current or previous encryption attempt.","21ead34c-d2d4-2799-6318-2ff9e4aa9222"
"CVE-2024-1708 - ScreenConnect Path Traversal Exploitation - Security","critical","security","","This detects file modifications to ASPX and ASHX files within the root of the App_Extensions directory, which is allowed by a ZipSlip vulnerability in versions prior to 23.9.8. This occurs during exploitation of CVE-2024-1708.
This requires an Advanced Auditing policy to log a successful Windows Event ID 4663 events and with a SACL set on the directory.
","74d067bc-3f42-3855-c13d-771d589cf11c"
"ScreenConnect User Database Modification - Security","medium","security","","This detects file modifications to the temporary xml user database file indicating local user modification in the ScreenConnect server.
This will occur during exploitation of the ScreenConnect Authentication Bypass vulnerability (CVE-2024-1709) in versions <23.9.8, but may also be observed when making legitimate modifications to local users or permissions.
This requires an Advanced Auditing policy to log a successful Windows Event ID 4663 events and with a SACL set on the directory.
","82b185f4-cdcb-ba23-9fdb-dbc1a732e1a7"
"Potential Secure Deletion with SDelete","medium","security","","Detects files that have extensions commonly seen while SDelete is used to wipe files.","70c3269a-a7f2-49bd-1e28-a0921f353db7"
"Remote Schtasks Creation","medium","security","","Detects remote execution via scheduled task creation or update on the destination host","bc42c437-1ea8-fd0f-d964-e37a58d861fc"
"Rare Schtasks Creations","low","security","","Detects rare scheduled tasks creations that only appear a few times per time frame and could reveal password dumpers, backdoor installs or other types of malicious code","89ed0fbe-11b8-ce3c-e025-59925225ee99"
"Suspicious Scheduled Task Creation","high","security","","Detects suspicious scheduled task creation events. Based on attributes such as paths, commands line flags, etc.","cd7d9f05-3bf6-21f6-6686-e602ab6d72ba"
"Suspicious Scheduled Task Update","high","security","","Detects update to a scheduled task event that contain suspicious keywords.","d74b03af-7e5f-bc5b-9e84-9d44af3d61b7"
"Important Scheduled Task Deleted/Disabled","high","security","","Detects when adversaries stop services or processes by deleting or disabling their respective scheduled tasks in order to conduct data destructive activities","9ce591d7-6b6d-444a-8c27-8ca626dddad3"
"Scheduled Task Deletion","low","security","","Detects scheduled task deletion events. Scheduled tasks are likely to be deleted if not used for persistence. Malicious Software often creates tasks directly under the root node e.g. \TASKNAME","68d6fb03-e325-2ed1-a429-abac7adf7ba3"
"Diamond Sleet APT Scheduled Task Creation","critical","security","","Detects registry event related to the creation of a scheduled task used by Diamond Sleet APT during exploitation of Team City CVE-2023-42793 vulnerability
","05731ce3-cfda-dbba-3792-c17794a22cf7"
"Scheduled Tasks Names Used By SVR For GraphicalProton Backdoor","high","security","","Hunts for known SVR-specific scheduled task names","ae16af08-e56e-414a-ceba-cb62e9f3a2ef"
"OilRig APT Schedule Task Persistence - Security","critical","security","","Detects OilRig schedule task persistence as reported by Nyotron in their March 2018 report","798c8f65-068a-0a31-009f-12739f547a2d"
"Defrag Deactivation - Security","medium","security","","Detects the deactivation and disabling of the Scheduled defragmentation task as seen by Slingshot APT group","e4c7a334-7ecb-ef93-85dd-49185891fb7a"
"Kapeka Backdoor Scheduled Task Creation","high","security","","Detects Kapeka backdoor scheduled task creation based on attributes such as paths, commands line flags, etc.","fa0084fc-2105-cdc9-c7c1-1752bbb2e4d2"
"Task Deleted","informational","security","","Scheduled task was deleted.","de5ed02e-e7b5-47a0-a35c-06a907c988e4"
"Task Created","informational","security","","Scheduled task created. Malware often persists with tasks but also used legitimately often as well.","60d768ca-33e8-4f34-b967-14fd7aa18a22"
"Suspicious Multiple File Rename Or Delete Occurred","medium","security","","Detects multiple file rename or delete events occurrence within a specified period of time by a same user (these events may signalize about ransomware activity).","a4504cb2-23f6-6d94-5ae6-d6013cf1d995"
"Stored Credentials in Fake Files","high","security","","Search for accessing of fake files with stored credentials","888d3e17-a1ed-6b11-895c-e1f9b96b35be"
"Sysmon Channel Reference Deletion","high","security","","Potential threat actor tampering with Sysmon manifest and eventually disabling it","249d836c-8857-1b98-5d7b-050c2d34e275"
"SCM Database Handle Failure","medium","security","","Detects non-system users failing to get a handle of the SCM database.","474caaa9-3115-c838-1509-59ffb6caecfc"
"LSASS Access From Non System Account","medium","security","","Detects potential mimikatz-like tools accessing LSASS from non system account","06b8bcc0-326b-518a-3868-fe0721488fb8"
"WCE wceaux.dll Access","critical","security","","Detects wceaux.dll access while WCE pass-the-hash remote command execution on source host","de10da38-ee60-f6a4-7d70-4d308558158b"
"Password Dumper Activity on LSASS","high","security","","Detects process handle on LSASS process with certain access mask and object type SAM_DOMAIN","d81faa44-ff28-8f61-097b-92727b8af44b"
"NetNTLM Downgrade Attack","high","security","","Detects NetNTLM downgrade attack","68f0908b-8434-9199-f0a3-350c27ac97c4"
"Processes Accessing the Microphone and Webcam","medium","security","","Potential adversaries accessing the microphone and webcam in an endpoint.","32337bc9-8e75-bdaf-eaf4-d3b19ee08a67"
"SAM Registry Hive Handle Request","high","security","","Detects handles requested to SAM registry hive","d7742b08-730d-3624-df95-cc3c6eaa3a39"
"Potential Secure Deletion with SDelete","medium","security","","Detects files that have extensions commonly seen while SDelete is used to wipe files.","70c3269a-a7f2-49bd-1e28-a0921f353db7"
"SysKey Registry Keys Access","high","security","","Detects handle requests and access operations to specific registry keys to calculate the SysKey","63308dbe-54a4-9c70-cc90-6d15e10f3505"
"Service Registry Key Read Access Request","low","security","","Detects ""read access"" requests on the services registry key.
Adversaries may execute their own malicious payloads by hijacking the Registry entries used by services.
Adversaries may use flaws in the permissions for Registry keys related to services to redirect from the originally specified executable to one that they control, in order to launch their own code when a service starts.
","d1909400-93d7-de3c-ba13-153c64499c7c"
"Azure AD Health Service Agents Registry Keys Access","medium","security","","This detection uses Windows security events to detect suspicious access attempts to the registry key values and sub-keys of Azure AD Health service agents (e.g AD FS).
Information from AD Health service agents can be used to potentially abuse some of the features provided by those services in the cloud (e.g. Federation).
This detection requires an access control entry (ACE) on the system access control list (SACL) of the following securable object: HKLM:\SOFTWARE\Microsoft\ADHealthAgent.
Make sure you set the SACL to propagate to its sub-keys.
","763d50d7-9452-0146-18a1-9ca65e3a2f73"
"ISO Image Mounted","medium","security","","Detects the mount of an ISO image on an endpoint","4faa08cb-e57e-bb07-cfc2-2153a97a99bf"
"ETW Logging Disabled In .NET Processes - Registry","high","security","","Potential adversaries stopping ETW providers recording loaded .NET assemblies.","107a403c-5a05-2568-95a7-a7329d714440"
"Azure AD Health Monitoring Agent Registry Keys Access","medium","security","","This detection uses Windows security events to detect suspicious access attempts to the registry key of Azure AD Health monitoring agent.
This detection requires an access control entry (ACE) on the system access control list (SACL) of the following securable object HKLM\SOFTWARE\Microsoft\Microsoft Online\Reporting\MonitoringAgent.
","321196fe-fb10-6b13-c611-3dfe40baa1af"
"Windows Defender Exclusion List Modified","medium","security","","Detects modifications to the Windows Defender exclusion registry key. This could indicate a potentially suspicious or even malicious activity by an attacker trying to add a new exclusion in order to bypass security.
","8948f034-2d45-47bc-c04b-14ab124247f3"
"Suspicious Teams Application Related ObjectAcess Event","high","security","","Detects an access to authentication tokens and accounts of Microsoft Teams desktop application.","04a055ea-ffa9-540b-e1d2-d5c1bfd5bc7b"
"Potentially Suspicious AccessMask Requested From LSASS","medium","security","","Detects process handle on LSASS process with certain access mask","c7f94c63-6fb7-9686-e2c2-2298c9f56ca9"
"Windows Defender Exclusion Registry Key - Write Access Requested","medium","security","","Detects write access requests to the Windows Defender exclusions registry keys. This could be an indication of an attacker trying to request a handle or access the object to write new exclusions in order to bypass security.
","777523b0-14f8-1ca2-12c9-d668153661ff"
"HybridConnectionManager Service Installation - Registry","high","","registry_event","Detects the installation of the Azure Hybrid Connection Manager service to allow remote code execution from Azure function.","0a77c311-af5b-b0e4-4d1d-e87ede81b2c7"
"WINEKEY Registry Modification","high","","registry_event","Detects potential malicious modification of run keys by winekey or team9 backdoor","c28049f8-7766-14aa-616f-a8628ee679bd"
"Suspicious Run Key from Download","high","","registry_event","Detects the suspicious RUN keys created by software located in Download or temporary Outlook/Internet Explorer directories","f81b1344-1639-27dc-c1e1-577c4e6c8e19"
"Office Application Startup - Office Test","medium","","registry_event","Detects the addition of office test registry that allows a user to specify an arbitrary DLL that will be executed every time an Office application is started","3b19eda3-3430-8cdc-686c-e0d94a32427d"
"Shell Open Registry Keys Manipulation","high","","registry_event","Detects the shell open key manipulation (exefile and ms-settings) used for persistence and the pattern of UAC Bypass using fodhelper.exe, computerdefaults.exe, slui.exe via registry keys (e.g. UACMe 33 or 62)","b1bd0320-da55-2715-927f-f70a3cb846fa"
"Potential Qakbot Registry Activity","high","","registry_event","Detects a registry key used by IceID in a campaign that distributes malicious OneNote files","52da4b83-76bb-1c03-3d3d-d2767a05c186"
"Atbroker Registry Change","medium","","registry_event","Detects creation/modification of Assistive Technology applications and persistence with usage of 'at'","5c5490c6-68eb-786c-e6b0-12374dce833f"
"New PortProxy Registry Entry Added","medium","","registry_event","Detects the modification of the PortProxy registry key which is used for port forwarding.","930cd1b8-c592-1982-65c9-cf7fecc0adf7"
"Path To Screensaver Binary Modified","medium","","registry_event","Detects value modification of registry key containing path to binary used as screensaver.","f5a1f729-ff8c-577e-2d33-a209e00bf7f3"
"Potential Credential Dumping Via LSASS SilentProcessExit Technique","critical","","registry_event","Detects changes to the Registry in which a monitor program gets registered to dump the memory of the lsass.exe process","c42f7ed2-10ea-21b4-bcc5-6978cbf4ca0d"
"Security Support Provider (SSP) Added to LSA Configuration","high","","registry_event","Detects the addition of a SSP to the registry. Upon a reboot or API call, SSP DLLs gain access to encrypted and plaintext passwords stored in Windows.
","a2b70475-be0a-993d-b01f-8ecf4bbd7576"
"Registry Entries For Azorult Malware","critical","","registry_event","Detects the presence of a registry key created during Azorult execution","46595663-e666-c413-ccf4-028a618ca712"
"New DLL Added to AppCertDlls Registry Key","medium","","registry_event","Dynamic-link libraries (DLLs) that are specified in the AppCertDLLs value in the Registry key can be abused to obtain persistence and privilege escalation
by causing a malicious DLL to be loaded and run in the context of separate processes on the computer.
","0af15a7d-56b4-6742-50d9-011df5f8449e"
"PrinterNightmare Mimikatz Driver Name","critical","","registry_event","Detects static QMS 810 and mimikatz driver name used by Mimikatz as exploited in CVE-2021-1675 and CVE-2021-34527","33feb9a9-afd4-3403-46c9-13a7b4a62b80"
"Disable Security Events Logging Adding Reg Key MiniNt","high","","registry_event","Detects the addition of a key 'MiniNt' to the registry. Upon a reboot, Windows Event Log service will stopped write events.","36ef53bd-ce38-b8b6-b163-c7ff42107ecb"
"Wdigest CredGuard Registry Modification","high","","registry_event","Detects potential malicious modification of the property value of IsCredGuardEnabled from
HKLM:\SYSTEM\CurrentControlSet\Control\SecurityProviders\WDigest to disable Cred Guard on a system.
This is usually used with UseLogonCredential to manipulate the caching credentials.
","60c241e3-567b-86bb-ae42-0e0b650b51ec"
"Sticky Key Like Backdoor Usage - Registry","critical","","registry_event","Detects the usage and installation of a backdoor that uses an option to register a malicious debugger for built-in tools that are accessible in the login screen","255a8d48-2f51-b8e1-ed5c-4063555a7569"
"Registry Persistence Mechanisms in Recycle Bin","high","","registry_event","Detects persistence registry keys for Recycle Bin","1617c214-9562-4819-58cd-ffa7929cf167"
"Pandemic Registry Key","critical","","registry_event","Detects Pandemic Windows Implant","a36fab91-8874-79c8-32cb-b2a0117d5a0b"
"New DLL Added to AppInit_DLLs Registry Key","medium","","registry_event","DLLs that are specified in the AppInit_DLLs value in the Registry key HKLM\Software\Microsoft\Windows NT\CurrentVersion\Windows are loaded by user32.dll into every process that loads user32.dll","5e3a86ef-f4fb-dd10-9bc7-e7c2d0a15e70"
"Narrator's Feedback-Hub Persistence","high","","registry_event","Detects abusing Windows 10 Narrator's Feedback-Hub","e45e543e-8d13-302c-2825-398896bd0bf8"
"Suspicious Camera and Microphone Access","high","","registry_event","Detects Processes accessing the camera and microphone from suspicious folder","139f52db-35af-c5f8-bbf8-22a2094dfea6"
"Enable Remote Connection Between Anonymous Computer - AllowAnonymousCallback","medium","","registry_set","Detects enabling of the ""AllowAnonymousCallback"" registry value, which allows a remote connection between computers that do not have a trust relationship.","153b0ce0-9f0b-f10f-7d6e-3a23dea83494"
"Esentutl Volume Shadow Copy Service Keys","high","","registry_event","Detects the volume shadow copy service initialization and processing via esentutl. Registry keys such as HKLM\\System\\CurrentControlSet\\Services\\VSS\\Diag\\VolSnap\\Volume are captured.","f6fed793-a359-2cae-0383-6ec6a9aee77b"
"Windows Registry Trust Record Modification","medium","","registry_event","Alerts on trust record modification within the registry, indicating usage of macros","b2a0af70-a308-0185-6128-c2e37db1ebf2"
"Windows Credential Editor Registry","critical","","registry_event","Detects the use of Windows Credential Editor (WCE)","092a900e-c6b2-7064-f7b5-699f1b3be49d"
"DLL Load via LSASS","high","","registry_event","Detects a method to load DLL via LSASS process using an undocumented Registry key","f90321bd-3a7e-2f0a-220f-49096e6b8ef5"
